<?xml version="1.0" encoding="UTF-8"?>
<?xml-stylesheet type="text/css" href="estilo-ii-2a.css" ?>
<!DOCTYPE fichero SYSTEM "fichero-ii2a.dtd">
<!-- ejerciciodtd2a.xml GRUPO 01 -->

<fichero>
 <ficha>
 <titulo>Datos Personales</titulo>
 <icon>
<svg version="1.1" id="user" xmlns="http://www.w3.org/2000/svg" xlink="http://www.w3.org/1999/xlink" x="0px" y="0px"
	 viewBox="0 0 785.8159 1010" enable-background="new 0 0 785.8159 1010" height="512px" width="512px" space="preserve">
	<path fill="#323B5A" d="M392.9692,0c135.251,0,244.8565,109.5234,244.8565,244.6914c0,135.312-109.6055,244.8145-244.8565,244.8145
		c-135.1269,0-244.7734-109.5025-244.7734-244.8145C148.1958,109.5234,257.8423,0,392.9692,0z"/>
	<path fill="#323B5A" d="M785.8159,1010h-0.5762H0V876.8457c0-173.7793,109.3999-321.1318,261.9521-376.0586l131.0171,174.6016
		l130.9756-174.6016c152.5938,54.9268,261.8711,202.2793,261.8711,376.0586V1010z"/>
</svg>
</icon>
<datos>
  <nombre sexo="femenino" edad="17">Angelina</nombre>
  <apellido>Fernandez</apellido>
  <direccion>c/Ulises, 36</direccion>
  <a href="../../../index.html" xmlns="http://www.w3.org/1999/xhtml">Volver al inicio</a>
  </datos>
 </ficha>
</fichero>